name,url,level,flavor,species,,,
Castor the Mortal,https://i.imgur.com/fWWdyA0.jpeg,555,steps forward and strikes with a hero's mortal steel,Humanoid,,,
Pollux the Divine,https://i.imgur.com/ndSizEP.jpeg,556,descends in radiance and smites with divine might,Celestial,,,
The Gemini Twins,https://i.imgur.com/lDOo8zj.png,557,"move as one, crossing their blows in a twin-fated strike",Celestial,,,
"Lucifer, Fallen",https://i.imgur.com/gEYY2MC.jpeg,663,lashes out with wings of blackened divinity and rage,Fiend,,,
"Lucifer, Maddened",https://i.imgur.com/OWAFpQp.jpeg,664,screams defiance and hurls chains of fallen starlight,Fiend,,,
"Lucifer, Enraged",https://i.imgur.com/w8Ko53p.jpeg,665,"erupts in a storm of apocalyptic, hell-forged flame",Fiend,,,
"Lucifer, Unbound",https://i.imgur.com/lBw1tGj.jpeg,666,tears reality with shackles of light that snap and fall away,Fiend,,,
"Aphrodite, Heaven's Envoy",https://i.imgur.com/sWGRcSK.png,886,shoots an angelic ray,Celestial,,,
"Aphrodite, the Eternal",https://i.imgur.com/ReSITHv.png,887,twists the fabric of existence,Celestial,,,
"Aphrodite, Harbinger of Destruction",https://i.imgur.com/4C7wxRJ.png,888,wills into being a cataclysm,Celestial,,,
Capybara Sauna,https://i.imgur.com/qumq3rP.png,999,"splashes you with scalding, herbal springwater",Aberration,,,
KPOP STAR,https://i.imgur.com/3OI1tI1.png,999,"hits the beat, then strikes with impossible precision",Celestial,,,
Loot Goblin,https://i.imgur.com/D1Qn2EQ.png,999,scatters coins and strikes while your gaze falters,Humanoid,,,
Random Korean Lady,https://i.imgur.com/hQB7G5k.png,999,gives you a puzzled look and strikes without warning,Humanoid,,,
Treasure Chest,https://i.imgur.com/7GXtbaH.png,999,snaps its lid and bites with rows of greedy teeth,Beast,,,
Yggdrasil,https://i.imgur.com/nuE1h9r.jpeg,999,shakes the world and smites you with roots of creation,Humanoid,,,
